<!ELEMENT lettera (cliente,ordine,responsabile)>
<!ELEMENT cliente (#PCDATA)>
<!ELEMENT ordine (articolo+)>
<!ATTLIST ordine num CDATA #REQUIRED >
<!ELEMENT articolo (codice,descr)>
<!ELEMENT codice (#PCDATA)>
<!ELEMENT descr (#PCDATA)>
<!ELEMENT responsabile (tit)>
<!ELEMENT tit (#PCDATA)>
